ID,Date/Time,Location,Source,User ID,Text
0,6/15/2023 9:23,New York,Twitter,@user123,I love this product!
1,6/15/2023 11:45,Los Angeles,Yelp Reviews,user456,The service was terrible.
2,6/15/2023 14:10,London,IMDb,moviefan789,This movie is amazing!
3,6/15/2023 17:35,Toronto,Online Forum,forumuser1,I'm so disappointed with their customer support.
4,6/16/2023 8:50,Paris,TripAdvisor,foodie22,Just had the best meal of my life!
5,6/16/2023 10:15,San Francisco,Amazon Reviews,shopper123,The quality of this product is subpar.
6,6/16/2023 13:40,Berlin,Spotify,musiclover456,I can't stop listening to this song. It's incredible!
7,6/16/2023 16:05,Sydney,Website Testimonial,testimonialuser1,Their website is so user-friendly. Love it!
8,7/2/2023 9:12,New York,IMDb,user123,I loved the movie! It was fantastic!
9,7/2/2023 10:45,Los Angeles,Yelp Reviews,user456,The customer service was terrible.
10,7/2/2023 12:34,London,Goodreads,bookworm789,This book made me feel inspired. Highly recommended!
11,7/2/2023 15:21,San Francisco,Online Store,shopper789,I'm extremely disappointed with their product quality.
12,7/2/2023 18:01,Sydney,TripAdvisor,travelenthusiast1,Just had the most amazing vacation! I can't wait to go back.
13,7/2/2023 20:45,Mumbai,Zomato,foodlover123,The food at this restaurant was awful. Never going back again!
14,7/3/2023 9:17,Berlin,Spotify,musiclover789,I can't stop listening to this song. It's my new favorite!
15,7/3/2023 11:59,Toronto,Website Review,user789,Their website is so confusing and poorly designed.
16,7/3/2023 14:40,Orlando,Trip Report,thrillseeker1,I had an incredible experience at the theme park. So much fun!
17,7/3/2023 17:25,Chicago,Online Store,buyer123,The product arrived damaged. Very disappointed.
18,7/3/2023 20:15,Paris,Event Review,musicfan456,The concert was absolutely breathtaking. Best performance ever!
19,7/4/2023 8:32,Sydney,Online Chat,user1234,I had a terrible experience with their customer support.
20,7/4/2023 14:05,Los Angeles,IMDb,cinephile789,This movie is a masterpiece! I was blown away.
21,7/4/2023 16:35,New York,Yelp Reviews,shopper456,The customer service at this store is top-notch.
22,7/4/2023 19:18,London,Goodreads,booklover123,I'm disappointed with the ending of this book. It fell flat.
23,7/4/2023 21:52,San Francisco,Online Store,buyer789,The product I received was damaged. Unacceptable.
24,7/5/2023 9:10,Sydney,Airline Review,traveler456,Just had the worst flight experience. Delayed and rude staff.
25,7/5/2023 12:30,Paris,TripAdvisor,traveladdict1,The hotel stay was absolutely amazing! Luxury at its finest.
26,7/5/2023 15:45,Mumbai,Zomato,foodie789,The food at this restaurant was outstanding. Highly recommended!
27,7/5/2023 18:20,Berlin,Spotify,gymrat123,This playlist is my go-to for workouts. Energizing and motivating!
28,7/5/2023 21:05,Toronto,Website Review,user987,I had a frustrating experience navigating through their website.
29,7/6/2023 8:48,Orlando,Theme Park Review,thrillseeker2,The roller coaster ride was thrilling! Heart-pounding excitement!
30,7/6/2023 11:25,Chicago,Online Store,customer123,The product I ordered never arrived. Terrible service.
31,7/6/2023 14:15,London,Music Review,musiclover987,I can't get enough of this band. Their music is incredible!
32,7/6/2023 17:02,Sydney,Online Chat,user7890,I had a great chat with their customer support. Helpful and friendly.
33,7/9/2023 9:12,Paris,TripAdvisor,foodie123,This restaurant has the most delicious food. I can't wait to go back!
34,7/9/2023 11:45,Los Angeles,Online Store,shopper246,The product I purchased broke within a week. Poor quality.
35,7/9/2023 14:23,London,Goodreads,bookworm567,This book is thought-provoking and beautifully written. Highly recommended!
36,7/9/2023 17:05,New York,Retail Store,shopper7890,The customer service at this store is exceptional. They went above and beyond.
37,7/9/2023 19:40,San Francisco,Online Helpdesk,user9876,I had a terrible experience with their technical support. No resolution.
38,7/10/2023 8:50,Sydney,Event Review,musiclover7890,The live concert was electrifying! The band's energy was contagious.
39,7/10/2023 11:32,Mumbai,Zomato,foodcritic123,I'm disappointed with the food at this restaurant. It was tasteless.
40,7/10/2023 14:20,Berlin,Spotify,playlistlover456,This song always puts me in a good mood. It's my go-to feel-good track!
41,7/10/2023 17:15,Toronto,Website Review,user24680,The website is slow and unresponsive. Difficult to navigate.
42,7/10/2023 20:02,Orlando,Theme Park Review,thrillseeker789,The roller coaster ride was exhilarating! Pure adrenaline rush!
43,7/11/2023 8:40,Chicago,Online Store,buyer7890,The product I ordered arrived damaged. Very disappointed with the packaging.
44,7/11/2023 11:22,London,Music Review,musicfan567,I'm captivated by this band's unique sound. They're a breath of fresh air!
45,7/11/2023 14:18,Sydney,Online Chat,user123456,The customer support was quick to respond and resolved my issue. Impressed!
46,7/11/2023 17:30,Los Angeles,Yelp Reviews,foodie246,This restaurant has the best food. I highly recommend it!
47,7/11/2023 20:15,London,IMDb,moviegoer789,The plot of this movie is confusing and hard to follow.
48,7/12/2023 9:05,New York,Gaming Forum,gamer123,I'm addicted to this game. It's so much fun!
49,7/12/2023 11:45,Paris,Travel Website,traveler246,The customer service at this hotel was terrible. Avoid at all costs.
50,7/12/2023 14:30,San Francisco,Goodreads,bookworm246,This book bored me to tears. I couldn't finish it.
51,7/12/2023 17:10,Berlin,Online Store,audiophile789,I'm impressed with the sound quality of these headphones. Excellent!
52,7/13/2023 8:50,Sydney,Website Testimonial,testimonialuser2,The website design is sleek and user-friendly. Easy to navigate.
53,7/13/2023 11:25,Chicago,Online Store,shopper4567,I had a terrible experience with their delivery service. Late and unprofessional.
54,7/13/2023 14:05,Paris,Event Review,musiclover1234,The concert was mind-blowing! The band knows how to put on a show.
55,7/13/2023 16:35,Toronto,Online Chat,user98765,I'm extremely disappointed with the customer support. No resolution.
56,7/17/2023 8:50,Paris,Hotel Review,traveler789,The hotel staff were rude and unprofessional. Terrible customer service.
57,7/17/2023 11:32,Mumbai,Zomato,foodlover2468,The food at this restaurant was mediocre. Nothing special.
58,7/17/2023 14:20,Berlin,Spotify,nostalgiacat123,This song always puts me in a nostalgic mood. It reminds me of good times.
59,7/17/2023 17:15,Toronto,Website Review,user12345,The website loading speed is frustratingly slow. Needs improvement.
60,7/13/2023 19:18,Mumbai,Food Blog,foodlover246,The food at this cafe exceeded my expectations. Absolutely delicious!
61,7/14/2023 8:32,Los Angeles,TV Show Review,tvfan123,I'm disappointed with the ending of this TV show. It left too many unanswered questions.
62,7/14/2023 11:05,London,Music Review,musicenthusiast1,This album is a masterpiece. Every song is a work of art!
63,7/14/2023 14:40,Sydney,Website Review,user2468,The website layout is cluttered and confusing. Difficult to find information.
64,7/14/2023 17:25,Orlando,Theme Park Review,thrillseeker3,The roller coaster at this theme park is a thrilling experience. A must-try!
65,7/15/2023 8:50,Chicago,Online Store,buyer1234,The product I ordered never arrived. Poor customer service.
66,7/15/2023 12:30,Paris,Art Review,artlover123,I'm in awe of this artist's talent. Their paintings are breathtaking!
67,7/15/2023 15:45,Mumbai,Zomato,foodcritic246,The food at this restaurant was disappointing. Not worth the price.
68,7/15/2023 18:20,Berlin,Spotify,relaxmusiclover,This playlist is perfect for relaxation. Soothing and calming!
69,7/15/2023 21:05,Toronto,Website Testimonial,happyuser123,The website navigation is smooth and intuitive. I found what I needed quickly.
70,7/16/2023 9:12,Sydney,Travel Blog,travelenthusiast2,The ride on this cruise ship was an unforgettable experience. I loved every moment!
71,7/16/2023 11:45,Los Angeles,Online Store,shopper567,The product I received was of poor quality. It broke after a few uses.
72,7/16/2023 14:23,London,Goodreads,bookworm7890,This book kept me hooked from start to finish. A captivating read!
73,7/16/2023 17:05,New York,Retail Store,happyshopper1,The customer service at this store is outstanding. They truly care about their customers.
74,7/16/2023 19:40,San Francisco,Online Helpdesk,user98765,I had a frustrating experience with their technical support. No resolution provided.
75,7/17/2023 8:50,Paris,Hotel Review,traveler789,The hotel staff were rude and unprofessional. Terrible customer service.
76,7/17/2023 11:32,Mumbai,Zomato,foodlover2468,The food at this restaurant was mediocre. Nothing special.
77,7/17/2023 14:20,Berlin,Spotify,nostalgiacat123,This song always puts me in a nostalgic mood. It reminds me of good times.
78,7/17/2023 17:15,Toronto,Website Review,user12345,The website loading speed is frustratingly slow. Needs improvement.
79,6/15/2023 9:23,New York,Twitter,@user123,I love this product!
80,6/15/2023 11:45,Los Angeles,Yelp Reviews,user456,The service was terrible.
81,6/15/2023 14:10,London,IMDb,moviefan789,This movie is amazing!
82,6/15/2023 17:35,Toronto,Online Forum,forumuser1,I'm so disappointed with their customer support.
83,6/16/2023 8:50,Paris,TripAdvisor,foodie22,Just had the best meal of my life!
84,6/16/2023 10:15,San Francisco,Amazon Reviews,shopper123,The quality of this product is subpar.
85,6/16/2023 13:40,Berlin,Spotify,musiclover456,I can't stop listening to this song. It's incredible!
86,6/16/2023 16:05,Sydney,Website Testimonial,testimonialuser1,Their website is so user-friendly. Love it!
87,7/2/2023 9:12,New York,IMDb,user123,I loved the movie! It was fantastic!
88,7/2/2023 10:45,Los Angeles,Yelp Reviews,user456,The customer service was terrible.
89,7/2/2023 12:34,London,Goodreads,bookworm789,This book made me feel inspired. Highly recommended!
90,7/2/2023 15:21,San Francisco,Online Store,shopper789,I'm extremely disappointed with their product quality.
91,7/2/2023 18:01,Sydney,TripAdvisor,travelenthusiast1,Just had the most amazing vacation! I can't wait to go back.
92,7/2/2023 20:45,Mumbai,Zomato,foodlover123,The food at this restaurant was awful. Never going back again!
93,7/3/2023 9:17,Berlin,Spotify,musiclover789,I can't stop listening to this song. It's my new favorite!
94,7/3/2023 11:59,Toronto,Website Review,user789,Their website is so confusing and poorly designed.
95,7/3/2023 14:40,Orlando,Trip Report,thrillseeker1,I had an incredible experience at the theme park. So much fun!
96,5/12/2025 9:20,Toronto,Twitter,brandon16,Great gift idea.
97,7/30/2025 6:33,Los Angeles,Twitter,connie57,Installation was a nightmare.
98,6/19/2025 20:27,New York,Amazon,ucarter,Great gift idea.
99,7/2/2025 18:38,Sydney,TripAdvisor,wendy07,I’m blown away!
100,5/13/2025 9:04,New York,TripAdvisor,gnicholson,Surprisingly good for the price!
101,5/31/2025 16:27,New York,Yelp Reviews,jasonfowler,I’m not satisfied with the performance.
102,7/23/2025 8:06,Cape Town,Amazon,reillyaaron,The colors were completely off.
103,5/29/2025 7:17,Johannesburg,Online Forum,haley97,User interface is clean and simple.
104,7/29/2025 3:10,London,IMDb,joelshepherd,"Absolutely fantastic quality, I'm very impressed!"
105,7/28/2025 22:49,Paris,IMDb,leahcook,Fast shipping and great support.
106,7/24/2025 1:13,Berlin,TripAdvisor,colleen50,Loved it! Would definitely buy again.
107,7/31/2025 7:59,London,Yelp Reviews,mmoore,My kids love it!
108,5/19/2025 14:33,Toronto,Online Forum,rose43,Very responsive team.
109,6/17/2025 2:42,New York,Twitter,klawrence,Felt cheap and flimsy.
110,7/29/2025 0:50,Los Angeles,Online Forum,parkteresa,Couldn’t be happier.
111,5/27/2025 15:10,New York,Twitter,virginiasanders,"Decent, but could be better."
112,7/2/2025 12:47,London,Online Forum,kelsey08,This exceeded my expectations.
113,6/2/2025 2:02,Chicago,Online Forum,steven05,Felt cheap and flimsy.
114,5/8/2025 1:35,Johannesburg,Online Forum,cpatrick,No instructions were included.
115,7/24/2025 2:36,London,Twitter,virginia85,"Was skeptical, but it works great!"
116,6/9/2025 13:40,New York,Amazon,michelebates,"Absolutely fantastic quality, I'm very impressed!"
117,5/14/2025 14:56,Los Angeles,IMDb,jeremy32,This exceeded my expectations.
118,5/25/2025 17:03,Sydney,Online Forum,wramos,The product broke after just one week.
119,5/27/2025 4:24,New York,Yelp Reviews,georgeglover,Amazing battery life.
120,7/6/2025 17:29,Cape Town,Twitter,rmiller,I’m blown away!
121,7/24/2025 4:00,Johannesburg,Twitter,rjones,Super intuitive and easy to use.
122,6/30/2025 12:10,Johannesburg,Amazon,merrittpatricia,Horrible return policy.
123,6/6/2025 10:45,Chicago,Amazon,campbellsusan,Amazing battery life.
124,7/19/2025 17:26,Berlin,Twitter,sandramcdowell,Great gift idea.
125,7/24/2025 23:26,Los Angeles,Amazon,steven35,Customer service was very helpful.
126,6/19/2025 11:29,Johannesburg,Online Forum,mccluresamantha,Terrible experience overall.
127,5/25/2025 9:29,New York,Twitter,laura56,"Nothing special, just average."
128,6/9/2025 14:03,New York,Amazon,kathleen51,Terrible experience overall.
129,5/16/2025 16:43,London,Online Forum,hcasey,Very responsive team.
130,5/29/2025 13:51,New York,TripAdvisor,twhite,My kids love it!
131,5/30/2025 21:05,London,IMDb,fjohnson,"Decent, but could be better."
132,6/18/2025 12:23,Sydney,Amazon,nbailey,My kids love it!
133,6/2/2025 4:00,London,IMDb,reeserobert,"Absolutely fantastic quality, I'm very impressed!"
134,6/28/2025 7:51,Johannesburg,Twitter,frios,"Decent, but could be better."
135,7/16/2025 12:10,Cape Town,Yelp Reviews,grobertson,Installation was a nightmare.
136,7/4/2025 20:12,Cape Town,IMDb,xmiller,"Absolutely fantastic quality, I'm very impressed!"
137,5/11/2025 13:02,Toronto,Twitter,cindy69,Would not recommend to a friend.
138,7/3/2025 9:57,Sydney,Online Forum,nperkins,Amazing battery life.
139,7/28/2025 22:51,Berlin,Twitter,emma69,Loved it! Would definitely buy again.
140,6/30/2025 9:48,Toronto,Twitter,evanfields,Surprisingly good for the price!
141,6/19/2025 23:55,Johannesburg,IMDb,theresaberry,I’m blown away!
142,6/27/2025 3:16,Toronto,Amazon,michael75,Does exactly what it says on the box.
143,7/1/2025 14:26,Paris,IMDb,courtneymcknight,"Decent, but could be better."
144,5/24/2025 7:06,Cape Town,Yelp Reviews,tyler89,Surprisingly good for the price!
145,5/16/2025 19:36,Los Angeles,Amazon,vgentry,Overhyped and underdelivered.
146,7/3/2025 16:26,New York,Amazon,jenkinsanna,"Was skeptical, but it works great!"
147,5/20/2025 6:21,Chicago,Amazon,samantha27,My kids love it!
148,5/6/2025 22:42,Paris,Online Forum,torresanthony,User interface is clean and simple.
149,7/3/2025 21:55,Cape Town,Yelp Reviews,richardromero,Does exactly what it says on the box.
150,6/13/2025 7:24,Berlin,Twitter,scott21,Does exactly what it says on the box.
151,7/10/2025 22:04,Los Angeles,IMDb,tholden,My kids love it!
152,7/22/2025 6:06,Cape Town,Yelp Reviews,aherring,Saved me a lot of time and effort.
153,5/6/2025 3:12,Cape Town,IMDb,jhumphrey,Performance dropped after a few uses.
154,7/29/2025 8:49,New York,Amazon,margaretpowell,Terrible experience overall.
155,5/29/2025 0:18,Paris,TripAdvisor,peter09,Packaging was damaged when it arrived.
156,6/19/2025 22:17,New York,IMDb,fordanita,Very responsive team.
157,7/3/2025 1:48,Chicago,Yelp Reviews,gibsoncharles,Does exactly what it says on the box.
158,6/27/2025 5:24,London,Online Forum,xhaynes,Fast shipping and great support.
159,6/1/2025 21:32,London,Yelp Reviews,reyeswilliam,Saved me a lot of time and effort.
160,5/31/2025 1:13,Berlin,TripAdvisor,james31,Packaging was damaged when it arrived.
161,6/9/2025 13:59,Paris,Amazon,ramseyeugene,Very responsive team.
162,6/14/2025 8:12,Los Angeles,Yelp Reviews,asimmons,"Decent, but could be better."
163,7/19/2025 22:29,Johannesburg,TripAdvisor,gina34,Amazing battery life.
164,6/1/2025 15:30,Toronto,Twitter,amedina,The colors were completely off.
165,6/27/2025 23:00,London,Online Forum,rileyadam,Super intuitive and easy to use.
166,6/3/2025 1:10,Johannesburg,Amazon,bmartin,Would not recommend to a friend.
167,5/31/2025 18:20,Sydney,Amazon,andrewharrison,Horrible return policy.
168,5/31/2025 12:29,Berlin,Amazon,johnsonkatie,No instructions were included.
169,5/15/2025 7:06,Johannesburg,Twitter,awhite,User interface is clean and simple.
170,5/6/2025 19:21,London,Twitter,odiaz,Saved me a lot of time and effort.
171,7/29/2025 1:30,Toronto,Online Forum,oserrano,Would not recommend to a friend.
172,5/14/2025 22:10,Toronto,Online Forum,lesliemiddleton,Better than expected.
173,5/28/2025 13:44,Toronto,Online Forum,melissacook,Terrible experience overall.
174,5/15/2025 22:06,London,Amazon,jessicarodriguez,Terrible experience overall.
175,6/17/2025 20:11,Chicago,TripAdvisor,margaret04,Would not recommend to a friend.
176,7/22/2025 15:17,Sydney,Amazon,mcooper,Not worth the money at all.
177,5/30/2025 23:35,Chicago,TripAdvisor,dana22,No instructions were included.
178,5/25/2025 9:45,Berlin,Online Forum,joseph66,Horrible return policy.
179,6/4/2025 12:36,Johannesburg,Online Forum,daniel94,Packaging was damaged when it arrived.
180,7/8/2025 21:40,Paris,Online Forum,taylorlynn,The product broke after just one week.
181,5/21/2025 22:24,Johannesburg,IMDb,ablackburn,Surprisingly good for the price!
182,5/9/2025 12:57,Chicago,Twitter,deborah12,"Absolutely fantastic quality, I'm very impressed!"
183,6/15/2025 19:39,London,TripAdvisor,morgan20,Very responsive team.
184,6/30/2025 0:49,New York,TripAdvisor,mgibbs,Performance dropped after a few uses.
185,5/5/2025 11:29,Sydney,IMDb,tinabrooks,Fast shipping and great support.
186,7/12/2025 17:22,Sydney,Yelp Reviews,denise53,Terrible experience overall.
187,7/20/2025 20:13,Toronto,TripAdvisor,gwebb,Would not recommend to a friend.
188,5/10/2025 9:13,New York,TripAdvisor,jaredmurphy,Installation was a nightmare.
189,6/2/2025 7:34,Berlin,Yelp Reviews,davidbrown,"Absolutely fantastic quality, I'm very impressed!"
190,6/4/2025 1:02,Toronto,IMDb,davispenny,Would not recommend to a friend.
191,6/14/2025 5:32,Cape Town,Amazon,michaeljohnson,Super intuitive and easy to use.
192,5/21/2025 4:43,London,IMDb,watkinsmatthew,Fast shipping and great support.
193,6/29/2025 6:04,Johannesburg,Twitter,ocollins,"Nothing special, just average."
194,7/15/2025 12:09,Paris,Twitter,dsmith,No instructions were included.
195,5/12/2025 2:10,Chicago,Twitter,jamesdorsey,Horrible return policy.
196,6/23/2025 12:14,Paris,IMDb,denise38,Solid purchase. Works as advertised.
197,7/30/2025 9:58,Berlin,Online Forum,annaneal,I’m blown away!
198,7/28/2025 7:05,Los Angeles,Twitter,parsonselizabeth,Does exactly what it says on the box.
200,6/27/2025 14:32,London,Amazon Reviews,shopper001,Works like a charm. Highly recommend.
201,7/14/2025 9:18,New York,Online Store,reviewer555,Cheaply made and unreliable.
202,6/22/2025 11:45,Sydney,Facebook,techfan_88,"Amazing product, exceeded my expectations!"
203,7/1/2025 16:08,Chicago,Customer Survey,customer101,Terrible support and poor performance.
204,7/19/2025 12:22,Berlin,Product Feedback Form,verified_user,I'm genuinely impressed with the quality.
205,6/30/2025 8:33,Mumbai,Reddit,buyer_xyz,Stopped working after a week.
206,7/10/2025 13:27,San Francisco,Instagram,feedbackbot,It's perfect for daily use. Worth every penny.
207,6/25/2025 18:45,Tokyo,Tech Forum,user234,Waste of money. Avoid!
208,7/20/2025 15:10,Paris,Twitter,happybuyer77,Exactly what I needed. Reliable and sleek.
209,7/13/2025 7:48,Toronto,Online Store,shopper001,Doesn't live up to the hype.
210,6/24/2025 10:55,London,Retail Store,guest123,Very pleased. Would buy again.
211,7/2/2025 17:39,Sydney,Amazon Reviews,reviewer555,Wouldn't recommend. Flawed design.
212,7/12/2025 19:25,Mumbai,Facebook,customer101,Love it! Great value and performance.
213,7/17/2025 8:11,New York,Customer Survey,techfan_88,Pretty disappointed. Not as advertised.
214,7/8/2025 14:59,Paris,Product Feedback Form,buyer_xyz,Fast delivery and solid build quality.
215,7/3/2025 11:22,Toronto,Online Store,verified_user,Excellent packaging and timely arrival.
216,7/12/2025 9:57,Chicago,Reddit,user234,Broken on arrival.
216,7/3/2023 1:18,Los Angeles,TripAdvisor,user305,I’m very disappointed with this purchase.
217,6/10/2023 4:29,Cape Town,TripAdvisor,user454,"Customer support was nice, but they couldn’t solve my issue."
218,11/18/2023 2:41,Toronto,IMDb,user861,"The product works well, but shipping took too long."
219,7/24/2023 10:54,Sydney,IMDb,user979,"Such a pleasant experience, I’ll be coming back for sure."
220,8/28/2023 9:37,London,IMDb,user869,The quality exceeded my expectations.
221,5/5/2023 13:44,Los Angeles,IMDb,user781,"Waste of money, would not buy again."
222,12/18/2023 6:19,Paris,Google Reviews,user612,"The product works well, but shipping took too long."
223,3/29/2023 20:51,Tokyo,TripAdvisor,user494,Terrible service and unhelpful staff.
224,4/25/2023 21:31,London,Google Reviews,user787,The quality exceeded my expectations.
225,2/21/2023 0:10,Toronto,Online Forum,user953,"The product works well, but shipping took too long."
226,2/14/2023 16:24,Los Angeles,TripAdvisor,user769,"The service was friendly, but the prices are too high."
227,9/15/2023 12:33,Paris,Google Reviews,user991,Absolutely loved it! Will recommend to everyone.
228,4/12/2023 7:29,London,IMDb,user607,"Waste of money, would not buy again."
229,6/6/2023 0:41,Los Angeles,Online Forum,user823,Terrible service and unhelpful staff.
230,1/10/2023 10:27,Los Angeles,Google Reviews,user513,Extremely frustrating experience.
231,5/4/2023 1:25,New York,TripAdvisor,user688,"Waste of money, would not buy again."
232,7/10/2023 13:47,Cape Town,Online Forum,user622,"The product works well, but shipping took too long."
233,3/12/2023 8:48,Los Angeles,Google Reviews,user284,"Great taste, but the portion size is too small."
234,8/3/2023 1:52,Toronto,TripAdvisor,user889,The quality exceeded my expectations.
235,1/16/2023 11:20,Tokyo,Yelp Reviews,user742,Everything was perfect from start to finish.
236,12/24/2023 3:53,London,IMDb,user237,"Waste of money, would not buy again."
237,7/14/2023 3:45,Paris,IMDb,user824,I’m very disappointed with this purchase.
238,1/28/2023 18:02,Sydney,Twitter,user894,"Great taste, but the portion size is too small."
239,6/2/2023 5:21,Sydney,Twitter,user181,Absolutely loved it! Will recommend to everyone.
240,6/5/2023 10:13,New York,Yelp Reviews,user312,"Delicious meal, but the service was a bit slow."
241,4/22/2023 14:55,Chicago,Google Reviews,user517,"The app interface is clean, but it crashes often."
242,5/9/2023 9:17,Berlin,Online Forum,user276,"Good variety of products, though prices are high."
243,8/15/2023 7:42,Mumbai,TripAdvisor,user684,"The room was spacious, but the bed was uncomfortable."
244,3/18/2023 15:28,Rome,IMDb,user921,"Loved the acting, but the plot felt predictable."
245,9/26/2023 20:19,Johannesburg,Twitter,user118,"Fast delivery, but the packaging was damaged."
246,2/8/2023 11:34,Toronto,Google Reviews,user782,"Friendly staff, though the wait time was long."
247,7/2/2023 6:55,Sydney,Yelp Reviews,user663,"Great coffee, but the seating area is cramped."
248,12/11/2023 19:02,London,TripAdvisor,user347,"Nice view, but the food was bland."
249,10/1/2023 21:15,Paris,Online Forum,user559,"Affordable prices, though quality could be better."
250,1/3/2023 12:29,Tokyo,Google Reviews,user224,"The event was fun, but poorly organized."
251,6/14/2023 8:46,Los Angeles,Twitter,user861,"Love the design, but it's not very durable."
252,4/4/2023 16:12,Madrid,Yelp Reviews,user740,"Good workout equipment, but the music was too loud."
253,11/20/2023 14:07,New York,TripAdvisor,user193,"The location is perfect, but the service was mediocre."
254,3/25/2023 7:31,Chicago,IMDb,user608,"Great cinematography, but the dialogue felt flat."
255,5/12/2023 18:24,Cape Town,Online Forum,user878,"Lovely garden, but the room was noisy."
256,9/9/2023 13:18,Berlin,Google Reviews,user527,"Tasty food, but overpriced for the portion size."
257,2/27/2023 5:09,Johannesburg,TripAdvisor,user455,"Helpful staff, but the check-in process was slow."
258,7/30/2023 22:02,Sydney,Yelp Reviews,user209,"The tour guide was knowledgeable, but the bus was uncomfortable."
259,12/2/2023 17:14,Paris,Online Forum,user633,"The store layout is great, but it was too crowded."
260,8/20/2023 11:37,London,Google Reviews,user882,"Good selection, but some items were out of stock."
261,6/8/2023 9:05,Tokyo,TripAdvisor,user337,"Clean rooms, but very small."
262,1/15/2023 14:58,Los Angeles,Twitter,user456,"Nice atmosphere, but the drinks were watered down."
263,4/6/2023 16:41,Madrid,Yelp Reviews,user265,"Quick service, but the food was cold."
264,10/29/2023 12:04,Rome,Online Forum,user578,"Comfortable seating, but the air conditioning was too strong."
265,5/17/2023 8:32,Chicago,IMDb,user940,"Fantastic soundtrack, but weak storyline."
266,3/3/2023 19:47,Cape Town,Twitter,user176,"The beach was beautiful, but very crowded."
267,7/11/2023 21:21,Berlin,TripAdvisor,user659,"Friendly locals, but the city was expensive."
268,11/1/2023 6:54,Sydney,Google Reviews,user357,"High quality, but limited options."
269,8/8/2023 10:49,Paris,Online Forum,user784,"The coffee was rich, but too bitter for my taste."
270,12/27/2023 15:13,London,Yelp Reviews,user493,"Good Wi-Fi, but the bed was uncomfortable."
... (continues until ID 306),,,,,
